{
  "schemaVersion": 1,
  "generatedAt": "2026-10-19T07:54:01.914Z",
  "usage": "ramonyx — CLI pengembangan Ramonyx\n\nPemakaian:\n  ramonyx dev              Vite + HMR (default :5173) → SSR (port dari config)\n  ramonyx build            Bundel klien → dist/client (jalankan sebelum start produksi)\n  ramonyx build --static   Bundel klien + prerender halaman → dist/static (hosting statis)\n  ramonyx build --target edge\n                           Bundel server edge/serverless → dist/edge (kontrak fetch handler)\n  ramonyx start            Server produksi (NODE_ENV=production, SSR)\n  ramonyx doctor           Diagnostik konfigurasi & lingkungan\n  ramonyx version          Versi CLI\n  ramonyx help             Bantuan ini\n\nOpsi:\n  --app <dir>       Direktori aplikasi (default: direktori kerja saat ini)\n  --config <path>   Path config (default: <app>/ramonyx.config.ts)\n  --port <n>        Override port server SSR\n  --dev-port <n>    Override port Vite (default 5173)\n  --static          (build) Prerender rute statis + getStaticPaths → dist/static\n  --target <nama>   (build) Target tambahan: \"edge\" → dist/edge (serverless/edge)\n  --watch           (build) Bangun ulang otomatis saat berkas berubah (Ctrl+C untuk keluar)\n\nKonvensi:\n  src/app.ts        mengekspor createApp(options?) → FetchHandler\n  src/routes        halaman (page.tsx/layout.tsx/error.tsx) + API (api/*.ts)\n  ramonyx.config.ts default export { app?, server? } (opsional)\n\n",
  "commands": [
    {
      "name": "dev",
      "summary": "Vite + HMR (default :5173) → SSR (port dari config)"
    },
    {
      "name": "build",
      "summary": "Bundel klien → dist/client (jalankan sebelum start produksi)"
    },
    {
      "name": "start",
      "summary": "Server produksi (NODE_ENV=production, SSR)"
    },
    {
      "name": "doctor",
      "summary": "Diagnostik konfigurasi & lingkungan"
    },
    {
      "name": "version",
      "summary": "Versi CLI"
    },
    {
      "name": "help",
      "summary": "Bantuan ini"
    }
  ],
  "flags": [
    {
      "flag": "--app",
      "argument": "dir",
      "description": "Direktori aplikasi (default: direktori kerja saat ini)"
    },
    {
      "flag": "--config",
      "argument": "path",
      "description": "Path config (default: <app>/ramonyx.config.ts)"
    },
    {
      "flag": "--port",
      "argument": "n",
      "description": "Override port server SSR"
    },
    {
      "flag": "--dev-port",
      "argument": "n",
      "description": "Override port Vite (default 5173)"
    },
    {
      "flag": "--static",
      "argument": null,
      "description": "(build) Prerender rute statis + getStaticPaths → dist/static"
    },
    {
      "flag": "--target",
      "argument": "nama",
      "description": "(build) Target tambahan: \"edge\" → dist/edge (serverless/edge)"
    },
    {
      "flag": "--watch",
      "argument": null,
      "description": "(build) Bangun ulang otomatis saat berkas berubah (Ctrl+C untuk keluar)"
    }
  ]
}
